{
  "$schema": "../../schemas/fixture-evidence.schema.json",
  "schema_version": "0.1",
  "fixture_version": "0.1",
  "fixture_id": "FX-EVM-TOKEN-001",
  "status": "candidate",
  "captured_at": "2026-07-28T17:08:25Z",
  "event_evidence": [
    {
      "evidence_id": "EV-TOKEN-FIRST-TRANSFER",
      "evidence_type": "transfer_event",
      "source_id": "DS-EVM-RPC-PUBLIC",
      "transaction_hash": "0xbbdaad89cb0d0d452663b7cb341f642b613d3563411807bcd990d1fffd855fa5",
      "block_number": 16642512,
      "transaction_index": 104,
      "log_index": 275,
      "address": "0xa0b86991c6218b36c1d19d4a2e9eb0ce3606eb48",
      "topic0": "0xddf252ad1be2c89b69c2b068fc378daa952ba7f163c4a11628f55a4df523b3ef",
      "from": "0xa406bc6e319cbe7ab2822cc55fa8376e9c3a7fdf",
      "to": "0xb4e16d0168e52d35cacd2c6185b44281ec28c9dc",
      "value_raw": "25000000000"
    }
  ],
  "call_evidence": [
    {
      "evidence_id": "EV-TOKEN-FIRST-RANGE",
      "evidence_type": "explorer_token_transfer_range",
      "source_id": "DS-EXPLORER-EVM",
      "query": {
        "module": "account",
        "action": "tokentx",
        "address": "0xa406bc6e319cbe7ab2822cc55fa8376e9c3a7fdf",
        "contractaddress": "0xa0b86991c6218b36c1d19d4a2e9eb0ce3606eb48",
        "startblock": 16642512,
        "endblock": 99999999,
        "page": 1,
        "offset": 5,
        "sort": "asc"
      },
      "first_result_transaction_hash": "0xbbdaad89cb0d0d452663b7cb341f642b613d3563411807bcd990d1fffd855fa5",
      "first_result_block_number": 16642512,
      "first_result_transaction_index": 104,
      "returned_count": 5
    }
  ],
  "state_evidence": [],
  "context_evidence": [],
  "source_requirements": [
    {
      "source_id": "DS-EVM-RPC-PUBLIC",
      "role": "scoring",
      "required": true,
      "purpose": "Raw receipt Transfer event and successful transaction status"
    },
    {
      "source_id": "DS-EXPLORER-EVM",
      "role": "scoring",
      "required": true,
      "purpose": "Ascending range query that establishes the first matching transfer"
    }
  ],
  "sources": [
    {
      "source_id": "DS-EVM-RPC-PUBLIC",
      "provider": "ethereum.publicnode.com",
      "endpoint": "https://ethereum.publicnode.com",
      "methods": [
        "eth_getTransactionReceipt"
      ],
      "retrieved_at": "2026-07-28T17:08:25Z",
      "reuse_artifact": "FX-SVC-DEX-001/raw-replay.json"
    },
    {
      "source_id": "DS-EXPLORER-EVM",
      "provider": "Blockscout compatibility API",
      "api": true,
      "endpoint": "https://eth.blockscout.com/api?module=account&action=tokentx&address=0xa406bc6e319cbe7ab2822cc55fa8376e9c3a7fdf&contractaddress=0xa0b86991c6218b36c1d19d4a2e9eb0ce3606eb48&startblock=16642512&endblock=99999999&page=1&offset=5&sort=asc",
      "retrieved_at": "2026-07-28T17:08:25Z"
    }
  ],
  "consistency_checks": {
    "range_first_result_matches_receipt_event": true,
    "token_matches_filter": true,
    "sender_matches_filter": true,
    "amount_decodes_exactly": true
  },
  "uncertainty": {
    "candidate_only": true,
    "remaining": "Independent raw eth_getLogs replay and zero-value/multi-log negative cases"
  },
  "provenance_notes": "The explorer range query establishes ordering while the raw receipt event establishes deterministic event fields. Neither source substitutes for the other."
}
