{
  "$schema": "../../schemas/fixture-evidence.schema.json",
  "schema_version": "0.1",
  "fixture_version": "0.1",
  "fixture_id": "FX-BTC-CJ-001",
  "status": "candidate",
  "captured_at": "2026-07-31T00:50:00+09:00",
  "event_evidence": [],
  "call_evidence": [],
  "state_evidence": [],
  "context_evidence": [
    {
      "evidence_id": "EV-BTC-CJ-PATTERN",
      "evidence_type": "equal_output_pattern",
      "source_id": "DS-BTC-API",
      "transaction_id": "074b02b446a3d55b26c33582f7a1b44691cd94ae87f50f430288b3213fea596a",
      "input_count": 103,
      "output_count": 194
    }
  ],
  "source_requirements": [
    {
      "source_id": "DS-BTC-API",
      "role": "supporting",
      "required": true,
      "purpose": "Candidate discovery and decoded fact cross-check"
    }
  ],
  "sources": [
    {
      "source_id": "DS-BTC-API",
      "provider": "mempool.space and Blockstream public REST",
      "retrieved_at": "2026-07-31T00:50:00+09:00"
    }
  ],
  "consistency_checks": {
    "two_provider_decoded_match": true,
    "negative_oracle_pass": true,
    "independent_verifier_pass": false
  },
  "uncertainty": {
    "candidate_only": true,
    "remaining": [
      "full raw artifact package",
      "detection methodology provenance",
      "independent verifier"
    ]
  },
  "provenance_notes": "Observed counts and equal-output values do not prove CoinJoin, ownership, criminality, or a single exit."
}
